-1	BCO BRADESCO SA, BRADESCO, Bradesco should lose R $ 356 mi with investment in BES, The rescue of Banco Espírito Santo (BES), revealed at the weekend, has spilled in one of its shareholders and arrived in Brazil. Owner of a participation of 3.9% in the Portuguese bank, Bradesco announced on Tuesday, 04, estimates losses of R $ 356 million in thirdquarter profit. Yesterday, at a meeting with analysts, the president of Bradesco, Luiz Carlos Trabuco Cappi said that the provision covers 100% of the exposure of the bank in BES.  The good standard, transparency, required the full low.  The Brazilian bank will make an accounting adjustment nonrecurring investment by this operation. Trabuco stressed that this is not a number  relevant to balance  of the institution, which in the last quarter earned R $ 3.8 billion. According to him, Bradesco followed what was happening with BES in recent months and now has the asset retirement.  That exhausts what we have.  The Brazilian bank is a member of the Portuguese financial institution since November 2000. The two companies have decided to strengthen their relationship after Bradesco have purchased the BES, through a exchange of shares, control of Boavista Interatlântico bank. Bradesco also holds a 20% stake in Banco Espirito Santo de Investimento (BESI) in the country. Trabuco says there is no interest to increase the share that drive and confirmed that it will be within the umbrella of the BES  good . The intervention announced on Sunday night, 03, the central bank predicts that the largest Portuguese financial institution denied the country will be divided into two: the good assets will be in the New Bank (also called New BES) and operations issues will be at the old BES the  bad bank. The new managers took credit of 4.9 billion euros to inject capital into the Bank and keep the doors open. The losses will be borne by creditors BancoEspírito Santo and its shareholders, as the French Credit Agricole (with 14.6% of BES), Bradesco (with 3.9%) and Portugal Telecom operator which owns 2.1% of capital of the Portuguese bank and a few days ago led default of about 900 million of the companies of the Espírito Santo Group. In Brazil, BES has over R $ 8 billion in assets as financial statements of 2013. The net worth of the bank was R $ 665.7 million at the end of December. Last year, BES Investimento do Brazil recorded net income of R $ 41 million  up 32% from 2012. The bank's BIS ratio was 14.2%, above the minimum required by the Brazilian Central Bank, 11%. The indicator measures how much the bank can lend without compromising its capital. In a statement, the bank stressed that its subsidiaries in Brazil are part of the New Bank and its organizational structure does not change. Stronger Yesterday, Vítor Bento, president of Banco Espírito Santo appointed to keep ahead of the socalled New Bank, said the bailout makes the institution  stronger and safer than before.  The uncertainties that threatened the institution in recent times have been removed , said the executive in publicana letter on the BES website. Former bank president also spoke. In a statement, Ricardo Espirito Santo Salgado said he looks forward to examining the institution's accounts to give his version of the crisis. The intervention gave impetus to the Lisbon Stock Exchange, which closed with a rise of 0.98%. The actions of the BES, which fell more than 40% on Friday and had their operations suspended, were traded. The information is the newspaper O Estado de S. Paulo. 	1	1	0	1	0	1	0	1	-1	-1	1	-1	1	-1	1	-1	1	-1	1
1	BCO SOFISA SA, SOFISA, Sofisa has high 1953.4% ​​in the second quarter earnings, Banco Sofisa (SDSA4), multiple bank specialized in lending to small and mediumsized companies, rose by 1953 4% in net income for the second quarter. Gains from R $ 0.3 million last year to R $ 5.4 million this. In the first half, net income was R $ 12 million. The loan portfolio in business segment rose 6.5% in the first quarter and 10.2% over the second quarter of 2013, driven by a sharp slowdown scenario in the industrial segment. The total portfolio went impacted by the Retail segment portfolio, which reached R $ 21.5 million, down 81.8% year on year. Loans to companies totaled R $ 1.8 billion, representing 98.8% of the total loan portfolio in the second quarter, up 6, 5%. Excluding acquired financings, the portfolio rose 7.4% in the first quarter and 12% over the second quarter of last year. 	-1	1	0	0	0	0	0	0	-1	1	1	1	1	0	1	-1	1	-1	-1
1	HOTELS OTHON SA, HOTELS OTHON, Othon Hotels grow 11.2% in net income in the 1st half, The Othon Hotels network today announced results for the first half of 2014. The highlight of the period was the growth of 27, 2% of EBITDA compared to the previous year, with a margin of 30.5%. In addition, the EBITDA of the first half in absolute terms was higher than the value of the whole year 2013, with a margin of 15.6%. Another great result for the period was an increase of 15.4% in net income. The net revenue reached the 11.2% mark higher than in the same period last year. The average daily rose 17.3%, another excellent a result which consolidates the continued growth presented by the network in recent years. The result of the first half of the year was marked by the positive effects of the World Cup. During the event, our hotels have guaranteed occupancy rates close to 100% and a significant increase the average daily, said Fernando Chabert, CEO of Othon Hotels Network. With five units in operation in the state of São Paulo, the network begins to operate in the coming months, another hotel, this time in Matão (SP). With R $ 8 million contribution of these investors Othon Hotel Apartments in Araraquara, and a total of 80 apartments, the project will serve, above all, the corporate audience, with an infrastructure that includes three meeting rooms, a restaurant and a fitness center. The goal is, in some years exceed the mark of 50 managed hotels. Also in the first half of 2014, the Othon Hotels Network finished the large investment of more than R $ 30 million in the modernization of three units of the Group: Rio Othon Palace, Belo Horizonte Othon Palace and Bahia Othon Palace. In May, the Belo Horizonte Othon Palace opened new lobby, with exclusive area for receiving the Othon Business, modernization of apartments, event areas and social areas, with investments of more than R $ 4 million. 	1	1	0	0	1	1	1	-1	0	1	1	1	1	-1	1	1	1	1	1
1	HOTELS OTHON SA, HOTELS OTHON, Network Othon will manage hotel Matão (SP), In the coming months, the Othon hotel chain will continue to invest in the project management of hotels. With five units in operation in the State of São Paulo, the network begins to operate in the coming months, another hotel, this time in Matão. With R $ 8 million contribution of these investors Othon Hotel Apartments in Araraquara, and a total of 80 apartments, the project will serve mainly to the business audience... The hotel has three meeting rooms The goal of the network is, in some years exceed the mark of 50 managed hotels Othon Recently the network completed a major investment of more than R $ 30 million in the modernization of three units: Rio Othon Palace, Belo Horizonte Othon Palace and Bahia Othon Palace. In May, the Belo Horizonte Othon Palace opened new lobby, with exclusive area for receiving the Othon Business, modernization of apartments, event areas and social areas, with investments of more than R $ 4 million., 	1	1	0	0	0	1	0	1	-1	1	1	1	1	-1	1	0	1	1	1
1	PROFARMA DISTRIB PROD FARMACEUTICOS SA, PROFARMA, Consolidated gross revenue Profarma reaches R $ 1.0 billion in 2T14, Profarma announced yesterday, August 14, the results for the second quarter of 2014. In 2T14, gross revenue consolidated totaled R $ 1.0 billion, roughly in line with the previous quarter and 3.3% higher than in 2Q13. Consolidated EBITDA margin Profarma remained stable at around 2.3%, even in a challenging environment as was the 2T14, which included a 6% reduction in the number of working days and an average increase of 1.0 medications pp lower than that recorded on 31 March 2013. At the end of June, the Company completed the process of capital increase and the strategic partnership with AmerisourceBergen which became part of the Profarma Social Capital with 19.9%. The capital increase provided the inflow of R $ 248.0 million. These funds will enable new shares in the growth strategy, and improve the capital structure, and, with potential savings of about R $ 31.0 million  year in financial expenses. For Max Fischer, CFO and IRO, the 2T14 marks the beginning of a new phase for the Company. 'Upon completion of the strategic partnership with AmerisourceBergen strengthen our position in the pharmaceutical market in the country, more diversified, increasing its interest in greater growth potential segments and higher rates of return  Specialty and Retail.. Also tailor our capital structure with the inflow of R $ 248.0 million, which will allow us to concentrate on our growth strategy, says Max In the division Distribution Farma. Original reporting segment and remains the main Company's business  the highlight was the reduction in operating expenses whose share of net revenues increased from 8.6% in 2Q13 to 8.3% in 2T14, despite the 3.0% reduction in revenue in the period. Sales for medium and independent customers grew 3.3% compared to 2Q13, even in a quarter that featured reduction in the number of working days. In the same period of comparison, Profarma achieved a reduction of 3.4 days in the cash cycle. The Specialties division increased by 15.1% in retail sales and 20.0% in the cancer category in comparison with the 2Q13, gross revenue totaled R $ 148.4 million 2T14. With the completion of the strategic partnership with AmerisoucerBergen, this division received the contribution of $ 40.0 million. In the retail division, in 2T14 was recorded 7.2% sales growth in Drogasmil  Farmalife, an increase in same store sales (SSS) and average sale shops  month of 18.6% and 37.6%, respectively , compared to the 2Q13. In the same period of comparison, the Tamoio network evolution was 13.5% in sales with an increase of 10.9% in samestore sales. The division also included improvement of 35.2% in EBITDA of Drogasmil  Farmalife and 11.5% of Tamoio compared to the previous quarter. 	1	1	1	1	1	1	0	1	0	0	1	1	1	-1	1	-1	1	1	1
1	PROFARMA DISTRIB PROD FARMACEUTICOS SA, PROFARMA, Profarma: Profit backs 83% in the 2nd quarter to R $ 2.1 million, Profarma Distribuidora Pharmaceutical Products had income of R $ 2.1 million in the second quarter of this year, down 83% on the gain of R $ 12.6 million recorded in the same period of 2013. The figure refers to net income attributable to controlling shareholders. The company was found net revenue of R $ 878.6 million in April period to June this year, 0.16% decline over the R $ 880 million in the same period last year. The cost of goods and or services sold totaled R $ 760.9 million in the second quarter, R $ 766, 3 million in the same 2013 period, down 0.7%. The Income before financial result and taxes (EBITA) stood at R $ 21.9 million in the second quarter, compared to R $ 24.6 million in the same period of 2013, a 10.8% decline. Data were reported on Thursday the Securities and Exchange Commission (CVM). 	1	1	0	0	0	1	0	1	0	0	1	1	-1	0	1	0	1	-1	1
1	PROFARMA DISTRIB PROD FARMACEUTICOS SA, PROFARMA, Profarma has gross revenues of R $ 1 billion in 2T14, Profarma announced on Thursday (14), the results for the second quarter of 2014. In the 2T14, the consolidated gross revenues reached R $ 1.0 billion, roughly in line with the previous quarter and 3.3% higher than in 2Q13. Consolidated EBITDA margin Profarma remained stable at around 2.3%, even in a challenging environment as was the 2T14, which included a 6% reduction in the number of working days and an average increase of 1.0 medications pp lower than that recorded on 31 March 2013. At the end of June, the Company completed the capital increase and the association strategic with AmerisourceBergen which became part of Social Capital Profarma with a share of 19.9%. The capital increase provided the inflow of R $ 248.0 million. These funds will enable new shares in the growth strategy while improving capital structure, and, with potential savings of about R $ 31.0 million  year in financial expenses. For Max Fischer, CFO and IRO, the 2T14 marks the beginning of a new phase for the Company. Upon completion of the strategic partnership with AmerisourceBergen we strengthen our position in the pharmaceutical market in the country, more diversified, increasing its interest in greater growth potential segments and higher rates of return  Specialty and Retail.. Also tailor our capital structure with the inflow of R $ 248.0 million, which will allow us to concentrate on our growth strategy, says Max In the division Distribution Farma. Original reporting segment and remains the main Company's business  the highlight was the reduction in operating expenses whose share of net revenues increased from 8.6% in 2Q13 to 8.3% in 2T14, despite the 3.0% reduction in revenue in the period. Sales for medium and independent customers grew 3.3% compared to 2Q13, even in a quarter that featured reduction in the number of working days. In the same period of comparison, Profarma achieved a reduction of 3.4 days in the cash cycle. The Specialties division increased by 15.1% in retail sales and 20.0% in the cancer category in comparison with the 2Q13, gross revenue totaled R $ 148.4 million 2T14. With the completion of the strategic partnership with AmerisoucerBergen, this division received the contribution of $ 40.0 million. In the retail division, in 2T14 was recorded 7.2% sales growth in Drogasmil  Farmalife, an increase in same store sales (SSS) and average sale shops  month of 18.6% and 37.6%, respectively , compared to the 2Q13. In the same period of comparison, the Tamoio network evolution was 13.5% in sales with an increase of 10.9% in samestore sales. The division also included improvement of 35.2% in EBITDA of Drogasmil  Farmalife and 11.5% of Tamoio compared to the previous quarter. 	1	1	1	1	1	1	0	1	0	0	1	1	1	-1	1	-1	1	1	1
1	AMBEV SA, AMBEV S  A, AmBev, The Companhia de Bebidas das Americas (AmBev) is a publicly traded producer of Brazil's consumer goods. According to data from Economatica, Ambev is the largest company in Latin daAmérica with a. market value of $ 120.1 billion, ahead of Ecopetrol and Petrobras was born of the merger between Antarctica and Brahma latter was controlled by the former owners of Banco Garantia:. Jorge Paulo Lehmann, Carlos Alberto Sicupira, Marcel Telles and Juan Vergara; the latter two, eventually turning AmBev.Dentro leaders of a controversial process, Ambev joined the Belgian brewer Interbrew and the result of this association was the creation of InBev, one of the leading brewers in the world There are doubts whether the Ambev. It remains a national company, or if it's just a subsidiary of Interbrew  Inbev. Ambev dominates much of the beverage market in Brazil, which also produces and distributes the brand Stella Artois in Brazil. They have license for Pepsi Co products in Brazil. In July 2009 the company received a fine of 352.7 million reais of the Administrative Council for Economic Defense by allegations of irregularities in the program  I'm with You , the company's loyalty program. Was elected by the Great Place to Work Institute (GPTW) as one of the hundred best companies to work for in Brazil even though one of the companies that respond to labor, according to the Ministry of Labor. In 2011, Ambev launched the franchise Our Bar, popular bars small. The network included 869 in August 2014. Ambev owns a number of brands in the segments where it operates. These brands are originating from several companies which were incorporated during the growth of the same. In 2013 the company developed for the primera vez, ice cream from beer. 	1	1	0	0	0	1	0	-1	0	1	1	1	1	-1	1	-1	1	1	1
1	AMBEV SA, AMBEV S  A, Ambev announces technology center in Rio de Janeiro and is expected to generate 50 jobs, Ambev announced on Tuesday (5) which will build a Center for Innovation and Technology for development of beers, teas, sports drinks, soft drinks and energy on the island of Bom Jesus, in Ilha do Governador, in Rio de Janeiro, which will employ 50 people directly on site. According to company president João Castro Neves, the construction of the center will cost R $ 180 million. It is the largest development center that the company will have perhaps the world, in such a special place, near Fundão. Today and tomorrow, we'll talk about the specific location and as a result go to the dates. Maybe here a year will not be there doing the opening? It would be great, and who know bringing a new product, said John Castro, at an event at the Palacio Guanabara. Also according to him, the investments of Ambev in 2014 amount to about US $ 3 billion and can grow. We've been hitting record investment, said the president, adding that despite not being able to announce how much the company will invest in 2015, the historical series simply demonstrates that comes a growing. This is a year that the World Cup makes an important period of growth. We made a bet not only in Rio but in Brazil. If we continue to invest in innovation, we surprise the consumer and our market can grow, he added. Prices and inflation Castro declared that can not tell if the price of beverages will be increased or not. However, he stated that there is more concern about the impact of the tax increase. He also pointed out that the Federal Government announced a few months that would not increase prices during the World Cup and that the company has been trying to keep the price below inflation. However, he added that the government calls the industry at some point to talk, and the conversation will determine what will happen. I'm sure there is a balance and hopefully we find one that avoids increase, which seek revenue and increase employment and investment. Inflation of drinks are below the overall inflation. So we are holding at all costs not to pass price for consumers, because last year he showed that he does not want it, said Castro, who added that the increase may be gradual, according to the government. Rio de Janeiro In the entire state of Rio de Janeiro, the cold beverage sector generates 350,000 direct, indirect and induced. According to Ambev, within that number, the company is responsible for 152,000 jobs. According to the Economic Development Secretariat of the State Government, this is the 18th international research center to be installed in Rio de Janeiro, 21 of which were implatados in Brazil over the past five years. 	1	1	0	1	0	1	0	1	0	0	1	1	1	-1	1	-1	1	1	1
1	AMBEV SA, AMBEV S  A, Copa assistance, and AmBev profit rises 16% in the 2nd quarter to R $ 2.2 billion, Helped by the World Cup, Ambev, the largest beverage company in Latin America, announced on Thursday (31) had a net income of R $ 2.2 billion in the second quarter, up 15.9% from the same period of 2013. In the first six months of the year, the gain was R $ 4.8 billion, an increase of 12.3% over the first half of 2013. The World Cup has boosted the company's bottom line in Brazil, offsetting the poor performance in Latin America South and Canada. According to Ambev, on 11 June, the eve of the start of the competition was the best day of the company's history of sales. The company's estimate is that the event has contributed about 1.4 million additional hectoliters of beer to vlome,  above our initial estimates of 4 times the impact of 300 000 hectoliters of the Confederations Cup,  says Ambev in a statement. The volume of nonalcoholic beer has more than doubled in the period, with Brahma 0.0% leading the category in Brazil.  	1	1	-1	0	0	1	0	1	0	1	1	1	1	1	1	-1	1	1	1
-1	AMBEV SA, AMBEV S  A, Petrobras back to overcome Ambev in market value, São Paulo. Petrobras again exceeded Ambev in market value, after accumulating 4% gains in the Bovespa only this week The same had occurred in the trading session of July 22, when the oil came to regain the lost position for about a year. The recent rise of the Brazilian stateowned shares to places with a market value of 247 billion reais, while Ambev is valued at. 240 billion reais, according to the BM  FBovespa Preferred shares of Petrobras have already accumulated a high of 23% in 2014, leaving the Ibovespa back. the main Brazilian stock index recorded gains of 8.4% in the same period Much High of Petrobras papers is justified by the recent election rally, triggered by favorable research candidate for president of the PSDB, Aécio Neves. I Ambev live another moment on the Bovespa and sees its common shares retreating 3.5% this week and almost 10% in 2014. The company saw its profit advance in the second quarter with the help of the World Cup and an increase in the volume of beer in Brazil, but suffered a reduction in the margin of profitability, pressured by the packaging mix in the period. The largest beverage company in Latin America reported net profit of 2.2 billion reais between April and June, up 15.9% year on year, in line with the market forecast. According to Ambev, the reduction in profitability margin was the result of a nonrecurring effect of the packaging mix, having invested in cans, which have a lower margin than the returnable packaging, and special editions for the World Cup. See below which are the largest companies by market capitalization in Latin America, according to data from Economatica. 	1	1	0	0	1	1	-1	-1	0	1	1	1	1	0	1	1	1	-1	1
1	AMBEV SA, AMBEV S  A, Ambev invests R $ 180 million in research center in technology in Rio, maker Ambev drinks will invest about 180 million dollars in the construction of a research center for technology in Rio de Janeiro, said on Monday the state government. The date for the start of work has not been disclosed so far, but, according to government sources, the forecast is that they can begin later this year with completion within two years. The center innovation and technology will be built on the island of Bom Jesus near the Fundão Island, in the north of the capital, which are already installed or under construction research centers of companies like Petrobras, General Electric, Siemens and others. The focus the center, according to the state government, will be the development of beers, soft drinks, teas, sports drinks and energy, as well as packaging. They will also be developed research to understand the perceptions and behavior of consumers. The contract with Ambev will signed on Tuesday in a ceremony at Guanabara Palace, seat of state government. 	1	1	0	0	0	1	0	1	0	1	1	1	1	0	1	0	1	1	1
-1	BCO PAN SA, BANK PAN, Grupo Silvio Santos wins time to explain Panamericano , The Securities and Exchange Commission (CVM) has extended the deadline for defense of former Banco Panamericano administrators up to May 7 in a process Administrative moved by the municipality, second order published in the Gazette on Friday. The process clears any irregularities in the preparation, analysis and dissemination of financial information of the bank,  that would have been subject to misrepresentation. Among the accused also are members of the Supervisory Board and technical and advisory bodies of the bank. They are part of the Silvio Santos Group Holdings and former executives of Panamericano, as Adalberto Savioli and Rafael Palladino. In 2010, Banco Panamericano found himself in trouble after discovery accounting inconsistencies. At the time, the Silvio Santos Group, then the bank's controller, announced investment of 2.5 billion reais, obtained with the Credit Guarantee Fund (FGC) to cover the problems identified in the institution. The following year, BTG Pactual bought the entire stake of the Silvio Santos Group in Panamericano. Currently the bank is called Pan Bank. 	1	1	0	0	1	-1	0	1	0	0	1	-1	-1	-1	0	-1	1	1	1
