1	BCO BRADESCO SA, BRADESCO, Bradesco approves R $ 10 billion to small and medium enterprises  Economy, Bradesco announced on Monday, 18, the release of an additional $ 10 billion to small and medium enterprises (SMEs) for training stock, working capital and payment of the 13th salary. The new lines are intended, according to Altair Antônio de Souza, executive director of the bank, giving impetus to small and medium business owner to take advantage of the increased demand in the second half. Besides the already traditional credits to capital working and payment of the 13th, Bradesco created a loan for stockpiling. The line, named Compose Easy stock, has the possibility of payment of the first installment only in January 2015. Rates start at 1.72% and the deadline is up to 13 months. According to Souza, the extent of grace aims to meet a demand of entrepreneurs who can not normally such period with suppliers. The bank maintained the target (guidance) credit for the year, which is an increase of 10 to 14%.   We are reviewing the guidance (for credit) because we believe that the demand is much higher this time. About 35% of our legal people base is small and medium enterprises. We believe that demand will meet the US $ 10 billion and we will stay in our guidance   Souza said in an exclusive interview to, information service in real time the State Agency. Lines announced today, according to him, are both for retail and for industry sectors. In the case of facing working capital reinforcement, Bradesco's focus are small businesses with revenues up to R $ 3.6 million a year and the resources can be used for any purpose. Souza points out that there is a supply chain around the elections involving media companies, graphic and other and are also a target audience for the lines.   We want to stimulate the Brazilian economy with new lines, supporting a sector that is fundamental to commercial activity, especially for yearend sales  , Souza adds. Credit for working capital, he said, is limited to $ 200,000 per customer. The deadline is up to 36 months. For the other lines, there is no limit, according to Souza. In the case of anticipation of the 13th salary, the period is up to 16 months. The initial fee for both this line as for working capital is 1.80% and the 90day grace period for the payment of the first installment.  13th salary  b> The executive director of Bradesco says institution expects a   good   growth for the advance line of the 13th salary. Last year, according to him, the growth was over 40% and the amount released was R $ 2 billion.   It is difficult to predict whether we will maintain the same pace of growth in this line. Last year growth even surprised us, but you may have yes. We expect good growth over 2013.  , says the executive, without disclosing numbers. The £ 10 billion announced today are a release of additional funds to R $ 28 billion the bank has available to small and mediumsized enterprises with annual revenues of up to R $ 3.6 million, according to Souza. During a conference call with press and analysts, bank executives commented that only 10% of this amount had been utilizado.As micro, small and medium enterprises accounted for 25.8% of Bradesco's loan portfolio in the second quarter, from R $ 435.2 billion. The loans for this segment declined 0.5% in the period before the first quarter to R $ 112.180 billion. Within a year, however, it was seen up 3.7%. The default in this public rose for a second quarter, from 4.2% in March to 4.4% in June. 	1	1	0	1	0	1	0	0	0	1	1	1	1	1	1	1	1	1	1
-1	BCO BRADESCO SA, BRADESCO, Bradesco search help startups to innovate  Start  Link  Estadao.com.br, In search of innovative solutions to try to keep up with the digital revolution that has affected the banking sector, Bradesco followed the trend of other major companies and will open its doors for startups The second largest private bank launches today across the country the, program to find innovative startups projects that can be adapted to the product sector and financial services With ten months in length.. being four months for the selection process.  the bank expects to select up to a dozen earlystage companies for over six months to develop a new product or service in the market and integrate their technology with the bank At the end, the startups formatarem their solutions successfully and will award a contract with Bradesco, to enter the market already with a major customer to its portfolio. A lot of startups are afraid to look for a company the size of Bradesco, because our first question will be who they are and have the execution capacity we need, says Bradesco's vicepresident, Mauricio Minas. We created the program to these small companies come here to make their products with us, instead of answering a Power Point presentation, he says. From now until October 17, the bank will accept, on the site of  nbsp ;, applications from earlystage companies that are developing their product, but have not yet entered the market. Among those enrolled, 40 companies will be selected to go through an immersion process to meet the bank and will be evaluated on issues such as qualification of the staff, value generation potential, delivery capacity, potential for innovation and risk measurement. Twenty shall be authorized for an evaluation stage with a group of bank executives. Of these, about ten to effectively follow the design phase of the project on banco.A initiative marks the first foray by the Bradesco open innovation. To date, the entire process of developing new solutions the bank was built. There are two or three years, we stopped to ask ourselves if our innovation model was the most efficient. Structured processes and methodologies to the closed innovation, but as we increasingly digital and needed a concept over break, we thought maybe the closed innovation was not enough for us, said Mines. Looking from the outside of the box ideas, the bank decided to resort to startups.  Nbsp; We want to leave the comfort zone and have more business options in the medium and long term, says Mines. The idea of ​​working with startups came after a research on how innovation is being held in American and European markets. Mine says he found that in Brazil there is still no proper appreciation of innovation. The difficulty of startups is not having a good product or business model. Nor is it financially, because there are people willing to give money to these companies. The big problem is the big barrier to entry in how these companies will survive even find a big market, he says. It is this large market that Bradesco to offer to startups chosen for their program. Instead of giving funding for entrepreneurs to touch their projects, Bradesco want to work with them to develop products and offer himself as premium end. The bank seeks solutions in five strategic areas: means of payment, digital channels, safe and Future Bank  which encompasses initiatives that could be adopted in the coming years for any area of ​​the bank. During the six months of development and integration of the product with the bank, startups should be devoted exclusively to Bradesco and could end go to the market looking for other customers. If something ever went to the market is no longer innovative, says Mines. During this period, the bank's professionals will provide support for startups also develop its business model through business consulting. At the end of the program, companies that excel may receive an investment bank.  Nbsp; The private equity fund of Bradesco, focused on medium to large businesses, showed interest in knowing the companies selected by InovaBra to evaluate investment opportunities and eventually create a line for startups.	1	1	0	-1	0	1	0	1	-1	1	1	1	1	-1	1	0	1	1	1
-1	BCO BRADESCO SA, BRADESCO, Bradesco is ordered to pay $ 70,000 a manager kidnapped in service. The general manager of a branch of Banco Bradesco in the municipality of Santa Ines, 280 km from Salvador, who was kidnapped when carrying values will be compensated at $ 70,000 by the bank. The decision was taken by the Superior Labor Court (TST) on August 6, according to whom the professional was exposed to risk by taking money to agencies in the vehicle itself. It is the feature. The assent to the manager was reported by Minister Lelio Bentes Correa, the First Panel of the TST. The magistrate held that the bank faced the Law 7,102  1983 determines hiring specialized personnel to perform transport of valuables. Corrêa considered the action requires payment of damages. The TST said the bank manager described in testimony, which was usually diverted the function and required to carry money in your own car or taxi to agencies from different cities of the state. Some of the target municipalities were cited more than 80 km of St. Agnes. In one of those occasions, the manager reported, in testimony, which was the victim of theft at gunpoint kidnapping followed by lightning, when it would have been about 40 minutes in the hands of the assailant in 2007. In the opinion of the TST, the manager is seeking damages for moral damages stating that after the trauma, began to suffer from psychological disorders and mental disorder, in addition to habitual use of controlled prescription drugs. The TST said Bradesco SA argued in defense that the '' cash transport is done by strong car and, rarely, per employee of the treasury, and never by the general manager of the agency. However, according to the TST, the realization of cash in transit by the manager was confirmed by witnesses. The process of origin was tried initially at the Regional Labor Court of the 5th Region (BA). According to TST, the Regional Court found the action inadmissible for having considered that the manager was not required to carry out the transport by the bank and that, as it is considered the highest authority within the agency, could send other employees performing the service. At the time, witnesses reported that the bank had driver to accompany the employee in the transport of valuables. The worker appealed and managed to have the request granted. For the rapporteur of the case, Minister Lelio Bentes Correa, the fact that the bank have driver for this purpose or that the worker be the general manager does not remove the duty to indemnify.  The unlawful conduct of the employer is in fact not contract, pursuant to Law 7,102  83, which specializes in the transport of liquid funds and to subject the employee to such risk activity  he said. The G1, Bradesco said it does not comment on cases that are pending. 	-1	1	0	1	0	1	0	-1	-1	-1	1	-1	1	1	-1	0	-1	-1	1
-1	BCO BRADESCO SA, BRADESCO, Doctors decide to continue without answering by Bradesco Saúde, In a meeting held late on Tuesday (12), the Union of the State of Bahia Doctors (Sindimed) unanimously agreed that the strike by the plan of care Bradesco Saúde continues in Bahia. The left doctors to accept the plan on June 25, after the company has not entered into an agreement with the category for the amounts paid by reference. No date set for a new meeting. According with Francisco Jorge Silva Magalhães, president of Sindimed,  as there was no signs of Bradesco Saúde, in terms of proposal, we keep the stoppage of calls. Magalhães said that next Monday (18) at 9am one conciliation hearing is scheduled at the headquarters of the Labor Court, located in the Trade Quarter. On July 29, Sindimed filed a civil action against the insurer. According to the advice of the union, the action brought by doctors snake recovery adjustments over 10 years. In assessing the category, the plan made further adjustments in the value of the tuition provided, and part of that amount was not passed on to doctors. At the time, Bradesco Health said in a statement that is among the private operators, nationally, better remunerate the medical procedure. The advice of the plan also said that annually adjusts the values ​​of consultations and medical procedures above the general inflation and the annual adjustment of rates of fees authorized by the National Health Agency (ANS). Bradesco Saúde also highlighted, through a statement that  your call center have not registered structural problems of assistance to its thousands of policyholders in the state of Bahia. According to Procon, during the stoppage of care, the agency and the National Health Agency (ANS) have received complaints regarding poor service plan services. The consumer protection agency points out that  the insured can not start or continue the proceedings, which represents an imminent danger to life, health and safety of consumers. In preliminary injunction was required to Bradesco Saúde efetive the contingency plan, spreading through all the masscirculation media, in addition to sending a letter and email to policyholders, a contact for which the insured may request a statement a doctor referenced that make call by plane. The preliminary injunction also says that if there are no providers referenced in the insured location, Bradesco Health should guarantee consumers choose to take the particular form of service, being forced repayment of integral.Caso form the insured does not have the required amount for the payment of the service, he may ask the Bradesco Saúde indicating a non referenced network service site, the plan should bear the costs of the procedures under daily fine of $ 200,000 for breach of the injunction. 	1	1	0	0	0	1	0	-1	-1	0	1	-1	1	-1	1	0	1	-1	1
-1	BCO BRADESCO SA, BRADESCO, Group explode ATMs of the Bradesco in Altamira do Maranhão, A gang blew up two ATMs of the Bradesco service station around 2:30 am Wednesday (27) in Altamira do Maranhão, in the western region the estado.Segundo police said four gunmen arrived on two motorcycles and blew up two ATMs. According to local residents, explosions rocked the structure of the building, which once had the roof destruído.A police arrived quickly on the scene and exchanged fire with the gang, who fled on motorcycles by the MA119 highway towards the city of Santa Luzia. The amount of money stolen was not informada.É the second time the station is blown up by robbers. The first took place in December last year. , 	1	1	0	0	1	1	0	-1	-1	-1	1	-1	1	0	-1	-1	-1	-1	1
-1	BCO BRADESCO SA, BRADESCO, see news sales Santander to Bradesco; Banks deny but unit fires  InfoMoney, SÃO PAULO  The Veja.com, magazine portal See, reported the sale of Santander Brazil () to Bradesco () on Wednesday (9) and removed the air information, application of both banks, a few minutes after the original publication Santander denied the information, saying it is incabível and invented.  either by own vehicle or some malicious source According to the original matter, Santander officials. had received an email firming that the sale would take place already in the 1st half  nbsp;.. According to the press office of Santander, the email quoted in the story was false, and never was  nbsp; The alleged lie, however, pasted on the market: the units of Santander soared in afterhours, up 1.97%  as much as possible  closing at R $ 15.51 These roles moved R $ 32 million in posttrading period, a value. too high for the time in which SANB11 usually moves about R $ 300 mil.O Bradesco also denied the information through its press office  denying   categorically   information. Speculation of a deal between the two banks is long: it is believed that Santander would be interested in selling its assets to save its operations in Spain, while Bradesco was interested in increasing its presence in national land  nbsp;.	1	1	0	0	0	1	0	-1	-1	-1	1	-1	1	-1	0	0	1	-1	1
-1	BCO BRADESCO SA, BRADESCO, Bradesco founder of Heirs lose share of R $ 3.09 billion in the Justice, Two of the daughters of the banker founder of Bradesco, Amador Aguiar, lost a billion dollar legal action. The case is considered the the country's largest heritage process. Information is the   Economic Value . According to the Special Court of the Superior Court of Justice (STJ), Lia and Lina Maria Aguiar are not entitled to receive, by way of inheritance , resources that could reach 4% of the common bank shares (valued at US $ 3.09 billion). According to the   Forbes  , Lina and Leah Aguiar are among the richest people in the country, with fortunes valued at R $ 2.86 billion and R $ 2.35 billion, respectively. The judicial decision was made late last month. However, according to the lawyer for the heirs, they will file an appeal to try to reverse the decision. The fight in the courts has lasted more than two decades. According to the   Value  , the Aguiar's daughters went to court after his father's death in 1991 for the stock values ​​of the Bradesco Foundation a renewed discussion the legacy left by his father. 	1	1	0	0	0	1	0	-1	0	-1	1	1	1	-1	1	1	1	1	1
1	BCO BRADESCO SA, BRADESCO, Bradesco profit rises 18% and reaches R $ 3.443 billion in Q1, With lower delinquency, Bradesco began in 2014 with net income of R $ 3.443 billion between January and March, 18 growth % compared to the same period last year anterior.Em recurring basis, which excludes extraordinary gains and losses, the profit of the second largest private bank in Brazil was R $ 3.473 billion. As a result, the annualized return on equity (ROAE) a profitability measure, rose from 19.5% at the end of the first quarter of 2013 to 20.5% in March this year. According to Bradesco, the outlook remains challenging.   The monetary stimulus reduction process part of the US central bank and the slowdown of the Chinese economy pose challenges to emerging countries  , quotes the bank's report.   In this sense, positive actions that seek to differentiate Brazil from other nations should be favorably views. Strengthening the fiscal commitment and continuing the fight against inflation are among these actions and are necessary condition for the country's economic growth   he adds. ' 	1	1	0	0	1	1	0	-1	0	1	1	1	1	1	1	1	1	1	1
-1	BCO BRADESCO SA, BRADESCO, Bradesco Health is triggered by the prosecutor, The state prosecutor, the ProconBA and the Bahia State Public Defender filed a civil suit against the care plan operator health Bradesco Saúde. In action , agencies are asking in preliminary injunction, the operator immediately disclose a telephone line to policyholders in all masscirculation media and through personal communication, email and registered mail. Through this number phone, the operator shall appoint a provider referenced to consumers who fail to medical care in the place of residence, such as examinations, consultations and procedures. 	1	1	0	0	0	1	0	-1	-1	-1	1	1	-1	-1	1	-1	1	-1	1
-1	BCO BRADESCO SA, BRADESCO, call by Bradesco Saúde follows suspended, The Union of Bahia Doctors (Sindmed) held on Wednesday, 23 at 19:30, an assembly in the Medical Association of Bahia (ABM) to address the refusal of Bradesco Health negotiate the proposals presented by category in the audience mediated by the Ministry of Labour, on the last day 16. The President of the Sindmed, Francisco Magalhães said that doctors of all specialties will decide whether to continue the boycott started Bradesco Saúde on 25 June. At the same time, the state prosecutor, the Office of Protection and Consumer Protection (Procon  Ba) and the Bahia State Public Defender awaiting court decision on civil action filed against the operator. In action, the organs are asking in preliminary injunction, the operator discloses a telephone line in all masscirculation media. Through this the insured may receive indication of a referenced provider if you can not care. By the action, the operator may be required to pay a fine of R $ 6 million, due to the damage caused to the community. Insured Amid this dispute, policyholders face various difficulties. The housewife Mary Help Rock Menezes, 44, is admitted to Holy Family Hospital, after being treated in another medical facility with symptoms of heart attack. Stabilized, it underwent several tests and the orientation of the cardiologist who attended was performing a catheterization for suspected blockage in a vein. She was transferred to the Holy Family on Sunday, and is admitted to the ICU. According to Barbara Eliodora, sister of Maria, on Monday last the family received hospital information that Bradesco refused to pay the medical fees of the professional who would do the catheterization. Bradesco Regarding the case of Mary Help of Bradesco Saúde said the case was referred to the board of care that will be taking steps today so that the procedure is performed. But on the civil action, said that   has not yet been notified and can not therefore manifest . The insurance ensures that   is seeking to find solutions that meet the interests of segments involved in Bahia . The insurer maintains that its call center meets uninterrupted by 40042700 (capital) and 0800 701 2700 (other locations) is able to guide the insured, including directing them to another specialist, in case of difficulty of care. Bradesco Health informs that the insured can get reimbursement for procedures performed out of your referral network, in accordance with the values ​​established by contract, according to the norms of the National Health Agency. Bradesco Saúde also informed that annually adjusts the values ​​of consultation and medical fees, most of the time above the general price indices and adjustment of fees authorized by the NSA. 	1	1	0	0	0	1	0	-1	-1	-1	1	-1	1	-1	-1	0	-1	-1	1
1	BCO BRADESCO SA, BRADESCO, Bradesco has R $ 3 billion profit in the 3rd quarter and has accumulated R $ 8.9 billion in the year, Bradesco (BBDC4) had net income of R $ 3.064 billion in the third quarter, growth of 7.1% over the same period last year, the bank said on Monday (21). On a recurring basis, net income for the second largest private bank in Brazil was R $ 3.082 billion in the period, slightly above expectations market. The amount is the third highest in history among banks for the third quarter, according to a survey conducted by consulting firm Economática. The first and the second highest profit in the third quarter were Itaú Unibanco, in R $ 3.807 billion in values From July to September 2011, and R $ 3.372 billion in the same period of 2012. With this result, Bradesco has accumulated R $ 8.924 billion gains in the year. In the first half, Bradesco reported net income of $ 5 , 86 billion, the largest in the bank's history for the period Reduction of default According to the report released by Bradesco, the quarterly result is due to factors such as lower allowance for doubtful accounts in light of the lower levels of default.; higher revenues from net interest income; and higher operating income from insurance, pension plan and capitalization. According to the analysis, the result was not higher because of   higher personnel expenses, reflecting mainly the collective bargaining agreement . The expanded credit portfolio grew 11% in the same comparison basis, reaching R $ 412.56 billion at the end of September this year. The default rate stood at 3.6% in the third quarter, down 0.1 percentage point from the third quarter of 2012 and 0.5 percentage points compared to the second quarter of this year. Expenses with Allowance for Loan Losses (PLL) totaled R $ 2.88 billion, lower by 6.9% over the second quarter of this year. 	1	1	0	0	1	1	0	-1	0	0	1	1	1	1	1	1	1	-1	1
