1	PETROLEO BRASILEIRO SA PETROBRAS PETROBRAS, Production of oil and natural gas hits record, says ANP, The National Petroleum Agency (ANP) said on Tuesday (2) that the total production of oil and natural gas in Brazil July reached 2.82 million of barrels of oil equivalent (BOE) per day, 2.267 million barrels of oil and 87.9 million cubic meters of natural gas. According to the ANP, the volume is the highest ever record, surpassing the previous month, when the production of oil and natural gas totaled 2.79 million barrels of oil equivalent per day. Also according to the ANP Production Report, the result was driven by oil production, which also surpassed the mark achieved in the previous month, to 2.246 million barrels per dia.Em compared to June 2014, the increase in oil production was 1%. Since compared to July 2013, there was increase of 14.8%. Already the natural gas production in July 2014 exceeded by 1.5% the previous month, 86.6 million cubic meters per day, and 12% to July 2013.Em around 90.7% of oil and natural gas production came from fields operated by Petrobras. Approximately 92.5% of oil production and 73.5% of natural gas production in Brazil were extracted from offshore fields. As occurred in June, the Roncador field in the Campos Basin, was the largest oil production, averaging 273,100 barrels per day. The largest natural gas producer was the Mexilhão field in the Santos basin, with a daily average of 6.8 million cubic meters. Presalt According to the ANP, production in presalt decreased 0.1% in July from the previous month, totaling 582,800 barrels of oil equivalent per day, 480,800 barrels of oil and 16.2 million cubic meters of natural gas per day. The production originated from 34 wells located in the fields of Blue Whale, Franca Whale, Humpback, Barracuda, Caratinga, Buzios, Sole, Squid, Marlim Leste, Pampo, Sapinhoá, Trail and in the areas of Iara and Surrounding of Iara.  	-1	1	0	0	0	1	0	1	0	1	1	1	-1	0	1	1	1	1	-1
1	PETROLEO BRASILEIRO SA PETROBRAS PETROBRAS, Bovespa operates on a high with Bank of Brazil and Petrobras, The Stock Exchange of São Paulo (Bovespa) operates higher on Wednesday (13), gains in shares of the Bank of Brazil and Petrobras. At 10h27, the Ibovespa, the main indicator of the São Paulo Stock Exchange, rose 0.28% to 56,600 points. The actions of the Bank of Brazil led the high between the actions of the Ibovespa, with a gain of 1.67%. As for the papers Petrobras, which weigh heavily on the indicator, rose about 0.6%. On Tuesday, the Bovespa closed down 0.3% at 56,442 points after strong sway over the trading floor. 	1	1	0	1	1	1	0	-1	-1	1	1	1	1	0	1	0	1	1	1
1	PETROLEO BRASILEIRO SA PETROBRAS, Petrobras, Petrobras will pay $ 434 million to the Bolivian YPFB in reckoning, The Bolivian state oil company YPFB (YPFB) will receive $ 434 million from Petrobras, in a showdown between the two State to resolve differences over the Bolivian natural gas import contract for the Brazilian market. Petrobras said the reckoning,  with payments and compensation for either party , will have a negative impact of about $ 268 million in its results for the third quarter, but a positive effect of $ 128 million in income for the year. According to the Brazilian state, it was also closed an agreement that guarantees the supply of natural gas to enable the thermal operation of Cuiabá until December 2016. Currently, YPFB sends 2.24 million cubic meters  day to Cuiaba, based on a contract that expires on August 31. According to the Bolivian state information agency, the president of Bolivia, Evo Morales, said after the closure of three new agreements, the short and medium term task is the beginning of negotiations to update the purchase and sale of natural gas, which sets the maximum shipping 30.08 million cubic meters of gas per day to Brazil until 2019. The contract signing was held in the city of Santa Cruz by YPFB President Carlos Villegas, and the director of Gas and Energy of Petrobras, José Alcides Santoro. Brazil is the biggest buyer of Bolivian natural gas and in the past has generated strong disputes during negotiations for the purchase and sale of oil contracts. Another agreement signed Monday sets a new delivery point of Bolivian natural gas and reducing its calorific value to expand the delivery options and investment for the liquefied gas extraction. 	-1	1	-1	1	0	1	0	1	0	0	1	1	1	0	1	1	1	-1	-1
-1	BCO SA BRAZIL, BRAZIL, ATMs are broken into at Our Lady of Lourdes, Another case of break the ATMs was recorded in the state early on Wednesday (27). The target was a branch of the Bank of Brazil in the city of Our Lady of Lourdes in the state of Hinterland. According to the delegate Jonathan Evangelista, five armed men broke into the agency about Das 2h. They used explosives and destroyed two boxes. The amount taken was not informed. This is the 14th case to break the bank branch registered in 2014 in Sergipe. 	1	1	0	0	0	-1	-1	-1	-1	-1	1	-1	-1	-1	-1	1	-1	-1	-1
-1	BCO SA BRAZIL, BRAZIL, Six people are arrested redhanded in bank robbery in Jaboatão, PE, A Brazil's Bank branch was robbed on Monday (1st), according to the military police. The unit is located on Highway Battle, the Prazeres district of Jaboatão dos Guararapes, metropolitan area of ​​Recife. Six people were arrested suspected of participating in the action. At the time of the assault, a police car was passing through the street. Six people were arrested in the act and a pouch was recovered. Three weapons were seized, as well as a car that was used by the group. Two men suspected of involvement in the crime managed to escape on a motorbike. The six arrested were referred to the Department of Suppression of Crimes Equity (DEPATRI)., the Drowned neighborhood, south of Recife Zone The press office of the Bank of Brazil in Pernambuco said it was not authorized to give information about the case. 	-1	1	0	0	1	1	-1	-1	-1	0	1	-1	-1	-1	-1	0	-1	-1	-1
-1	BCO SA BRAZIL, BRAZIL, Safe Brazil's Bank branch is broken open with torch in Mairi, A Bank of Brazil branch located in the municipality of Mairi, at 298 kilometers from Salvador, was invadidada by robbers in the early hours of Tuesday ( 26). According to the local police station officials, the incident occurred at around 0h15, and the action of criminals was not seen in the early morning after the arrival of employees. According to police, which still has information on the amount of people involved in the crime, the robbers entered the bank unit after they destroyed the windows of a window which is the agency's funds. Within the unit, the police reported that the burglars managed to break into the safe with a blowtorch. No information about amount taken by the suspects. Initial reports indicate that the assailants managed to turn off the alarm system of the external area, as well as security cameras. According to police, witnesses said they saw three suspicious cars circulating in some area before the crime. No one was arrested until the early evening of Tuesday (26). 	-1	1	0	0	0	1	0	-1	-1	-1	1	-1	1	-1	-1	0	-1	-1	-1
1	BCO SA BRAZIL, BRAZIL, the Bank of Brazil is R $ 2.829 billion profit in Q2, The Bank of Brazil said on Thursday it had net income of R $ 2.829 billion reais in the second quarter, compared to BRL 7.472 billion a year earlier. The decline was 62.1%. In the first half of this year, the institution recorded net income of R $ 5.506 billion, after reaching R $ 10 billion in the same period last year.  The result obtained in the first half was mainly driven by business expansion. The assets (assets) Total Bank of Brazil reached R $ 1.4 trillion in June, an increase of 15.3% in 12 months. The commercial captures Bank Brazil reached R $ 618.9 billion in June, up 14.2% in 12 months. The expanded credit portfolio of the Bank of Brazil reached R $ 718.8 billion in June, up 12.5% ​​in 12 months. The classified loan portfolio reached R $ 649.6 billion in June, a 12.9% increase in the same comparison. The individual expanded credit portfolio ended June at $ 173 billion, a 7.2% increase over the same month last year, accounting for 24.1% of the total portfolio,  especially the mortgage. On July 31, Bradesco opened the season of balance sheets of financial institutions and said it recorded net income of R $ 3.778 billion in the second quarter of 2014. The result is 9.7% higher than in the first three months of the year and 28.1% higher compared to the second quarter of 2013. Bradesco's profit is the largest in the history of the bank, for the second quarter, according to a survey of Economatica. On the same day, Santander Brazil announced that it had net income of R $ 527.5 million in the second quarter. In the first three months of the year, the value was R $ 518.4 million. As a result, Itaú Unibanco announced it had net income of R $ 9.318 billion in the first half of 2014, up from R $ 7.055 billion recorded in the second half of last year. According to Economatica, Itaú profit in the first six months of this year is the largest in the history of the bank considering that period. The leader among the banks is the Bank of Brazil, in the first half of 2013 reached R $ 10 billion profit. In the second quarter, the profit of the institution reached R $ 4.899 billion, up from R $ 4.419 billion recorded in the first three months of the year. 	1	1	0	0	0	1	0	1	0	-1	1	1	1	1	1	1	1	-1	1
-1	BCO SA BRAZIL, BRAZIL, Brazil STJ sends the Bank paying customers for the Summer Plan losses, The Second Section of the Superior Court of Justice (STJ) decided on Wednesday (13) that the Bank of Brazil must pay all the customer the country the difference related to the loss generated in savings accounts because of the Summer Plan in January 1989. In a statement, the bank said the decision has no immediate effect and will appeal the decision. The Court analyzed the bank's appeal on court ruling dating back to 2009, when the 12th Civil Court of Brasília was judged public civil action filed by the Brazilian Institute of Consumer Defense (Idec). That year, the Court had already condemned the bank to pay the socalled  inflation effects  which occur when inflation rates are not applied in savings and generate loss in the income deposited. The Bank of Brazil appealed to the court claiming that the sentence should be valid only for open savings accounts in the Federal District and only savers associated with Idec, plaintiff would have standing to seek the judgment. In the rapporteur's view feature in the STJ, Minister Luis Felipe Solomon, the former trial had decided that the decision should include all savers who kept account in the Bank of Brazil in January 1989, and not just those residing in the Federal District and were linked to Idec. The vote of the rapporteur was followed by other minitros. The press office of the Bank of Brazil said through a statement that the institution will file the appropriate appeals against the decision after the publication of the judgment.  The decision [...] shall not take immediate effect, it must await the publication of the judgment, on which the BB interpose the appropriate resources for the final pronouncement of the Supreme Court , the statement said. The Supreme Court did not say the amount the bank will have to pay if the determination of Justice is again confirmed. Created in an attempt to contain hyperinflation, the Summer Plan, as well as others created in the early 1990s, they changed the calculation of the indexation of savings balances. Almost 400,000 cases on economic plans are to conduct suspended in various courts since 2010, awaiting a Supreme Court decision. Plaintiffs argue that suffered losses and want to receive the corrected values ​​based on inflation. The Supreme Court judgment of Wednesday in Superior Court is different from the judgment of the Supreme Court (STF), in which the Supreme Court will determine the validity of economic plans and the restatement of the books values ​​occurred within the law. The trial would be held in late March, but was postponed and there is no new date. If the court finds that the percentage used by the plans was correct, many savers will not be entitled to anything. In that case, the Supreme Court can evaluate what to do with those who have received money from the banks by decision of other courts. Should the Supreme consider the irregular used index should stipulate how the payment of the correction of savings balances will be done. 	1	1	0	0	0	1	0	1	-1	1	1	-1	1	-1	-1	-1	1	-1	1
-1	HI SA, HI, Hi could lose investment grade by S  P after merger, Standard  Poor's put the credit note 'BBB' global scale Hi on negative watch after the merger announcement with Portugal Telecom. In practice , this means that the note is under review for a possible downgrade. If the cut in the rating is confirmed, the Hi lose the degree of 'investment' assigned by credit rating agency and would be considered as speculative level? o which may imply higher interest rates on debt issues. 'Based on preliminary assessments, the two combined companies should take longer to show stronger credit protection measures than we expected with a stable outlook for Hi', the analysts said S  P. in a statement, 	-1	-1	0	1	0	-1	0	-1	0	-1	1	1	-1	0	-1	1	-1	1	-1
-1	SA HI, HI, Hi is fined US $ 3.5 million for monitoring clients on the Internet, The Hi was fined by the Justice Department for $ 3.5 million for breaking consumer protection rules when monitoring customer behavior on the internet and sell this information to advertisers, advertising agencies and web portals. The decision was published on Wednesday (23) in the Official Gazette.The operator conduct of investigations were made by the Department of Protection and Consumer Protection (DPDC) National Consumer Bureau, under the MJ. The folder found that the Velox, broadband service Hi, violated the rights of information and consumer privacy, in addition to misleading advertising. The calculation began after DPDC have been was informed that Hi has partnered with Phorm, which created the Navigator software. The program is used to trace the steps of the consumer on the internet. The Hi states that do not use the tool since March 2013, when finished product testing together  to a client group guests. The company states still have  belief that there was no violation of consumer rights  and must resort. The DPDC informs that customer data are used to compose a detailed profile of each customer. These dossiers are sold to other companies who want to send ads to those people based on how they act on the network. According to the DPDC, the company did not inform the tool did this mapping, the consequences for the privacy of its customers and sell information of its customers to third parties without authorization. According to MJ, the company also violated the principles of the Internet Steering Committee in Brazil (CGI.br) of net neutrality (nondiscrimination package on the internet) and the standardization and interoperability. This is because the Navigator software redirects network traffic, and filter user data. To reach the amount of R $ 3.5 million to TNL PCS S  A (Hi), the DPDC considered the financial advantage gained from the violation of consumers, the company's size and the level of misconduct. The fine amount shall be deposited in the Diffuse Rights Defense Fund (FDD), which reverses its actions resources for consumer protection and environmental protection and public property. eja full note of Hi The company informs that does not use the Phorm tool, questioned in that process, and explains that since March 2013 have been closed all the operational initiatives of this tool by the Hi, which had its use restricted to a group of invited customers to test the product. The company adds that Phorm ended its activities in Brazil, as published in its annual report 2013. Hi reaffirms its conviction that there was no breach of consumer law and despite having not yet had access to the reasons for the decision , believes that it has strong elements to appeal. 	1	1	0	1	0	1	0	0	-1	1	1	-1	1	0	1	1	-1	-1	1
1	SA HI, HI, bank Group will offer new Hi shares with purchase guarantee, A group of banks, led by BTG, will make a new offer phone carrier's shares Hi with purchase guarantee. The news about the Business was published by the newspaper  Folha de S. Paulo  and confimada the press office of Itaú BBA, which is part of the group, on Friday (7). It was confirmed the total amount of the issue or the participation of each participating bank consortium. According to Itaú, the new offering will be taken to the market by banks seeking overseas buyers. The deal aims to raise funds for the company, which must reduce the proportion of net debt in relation the EBITDA profit (before interest, taxes, depreciation and amortization). The business model provides that if the banks do not find buyers for the tendered shares, will buy the papers that have not been sold. The banks that will sell and eventually buy the newly issued shares of Hi, it will be led by BTG Pactual, which have the largest shares of stock with a group of banks. Itaú will get smaller quotas, along with another group of banks. Merger with Portugal Telecom Hi signed the merger agreement with Portugal Telecom in October last year, a deal that will create a multinational operator with operations involving a population of 260 million people and more than 100 million customers.The agreement happened shortly after the Hi have made large cut in its dividend policy, pressed for a net debt of almost US $ 30 billion and need to accelerate investments in the country, according to Reuters. At the time of the merger, the companies said trademarks of operations of Hi and Portugal Telecom would be maintained in their respective regions of operation to  control and single, common management by Corpco. BTG Pactual said it will not comment on the information. 	1	1	0	0	0	1	0	1	0	-1	1	1	1	1	1	1	1	1	1
1	SA HI, HI, Interest and dollar operating on low; Ibovespa and clashes rises to Hi, Concern the US fiscal situation and the news of merger between Hi and Portugal Telecom guided partly business this afternoon in the Brazilian financial market. The future interest operated at low, aligned to the exchange rate movement and US Treasury bonds. The dollar yielded 1% against the real, putting the Brazilian currency on the list among the best performing currencies. In the São Paulo Stock Exchange, Bovespa, who started the day in negative territory, changed direction, with the strength of the shares of Hi. Outside, Wall Street recorded loss, together with interest on US Treasury bonds and the dollar, pressured by weak US employment figures and the fear at the lack of a tax agreement in Washington. The Dow Jones yielded 0.47%, the Nasdaq retreated 0.16% and the S  P 500 had low of 0.24%.The Bovespa was against the outside. At 13h51, the Ibovespa had an increase of 0.18% to 53,276 points. Hi's stock reacted to the news that Hi and Portugal Telecom signed a memorandum to join operations. The common shares were advancing 9.4% and the PN had rise of 11.3%. In the BM  F, the Interbank Deposit (DI) January  2017'd rate of 11.40% (11.48% in the adjustment yesterday). The DI January  2015 recorded 10.24% (10.31%). Side exchange, the commercial dollar fell 1.03% to R $ 2.2060. Dollar for November retreated 0.53% to R $ 2.2210. 	-1	1	0	0	0	1	-1	-1	0	-1	1	-1	1	-1	1	0	1	1	-1
1	SA HI, HI, Hi closes sale of telecommunications towers for R $ 1.17 billion, The Hi said on Wednesday (25) that its subsidiary Telemar Norte Leste and BRT Internet Services signed an agreement with the SBA Torres Brazil to transfer 1,641 telecom towers for $ 1.17 billion. According to the company, the amount will be received in December this year, expected date of closing. In a statement, Hi said the operation  strengthens and improves the financial flexibility of the company, which increase the salaries and debt maturities, reducing the cost associated with financing and strengthen the liquidity position of the Hi.  Additionally, the transaction brings benefit as the transfer to the buyer's responsibility , costs and investments in the operation, maintenance and expansion of the towers. At the same time, it ensures the continuity of the personal mobile service (SMP), in that it also comprises the space lease these towers through long contract term and lays down conditions for the expansion of rented space , it said. 	1	1	0	0	0	1	0	1	-1	1	1	1	-1	-1	1	0	1	-1	1
1	APRIL EDUCATION SA, APRIL EDUCATION April Education elects chairman and simplifies command, April Education announced on Monday a series of changes in its organizational structure. With Giancarlo Civita's election as chairman. Occupying a position that was vacant since the death of his father. Roberto Civita. in April of Education CEO junho.O. Manoel de Amorim. was named vice chairman of the board. The executive will also assume the position of interim CFO and investor relations. after the resignation of Fabio Carvalho. According to a statement of Abril Education. Carvalho leaves the company on Monday  to assume other responsibilities in another industry company. Without revealing details. Abril Education said that a new business has been hired to replace Carvalho definitely from August 12th. The company also revealed a number of other changes in its command line. wiping from 12 to five the number of units which will report directly to Chief Executive chain.For so much. They were created two new vice presidents and two new business units. Only the finance department who have reported directly to the chief executive will continue to do so. At 10h27. the Abril Education units exhibited high 0.17%. to R $ 35.02. with low turnover. At the same time. the Ibovespa. main index of the São Paulo Stock Exchange (Bovespa) operated with negative variation of 0.03%.SimplificaçãoA vice president of products and educational services encompass both the units of education systems. publishers and complementary products. as sales directors for governments and marketing.O goal. the company said. It is to strengthen the  customer focus, not just on the product. The command of the vicepresidency will be in charge of Mario Ghio Junior.atual CEO of ensino.publicidadeVera Balhestero systems. General Director of Ática and Scipione will head the new vice president of operations. and integration services. The unit will be comprised of the areas of information technology. education technology. shared services. logistics and operations and resources humanos.Completam the business team immediately below the chief executive of the unit schools and preparatory courses. led by João Almeida e Silva. and the Language teaching unit. On 1 August. Julio de Angeli chaired the group Ometz. owner of the brand Wise Up. purchased by April Education for € 877 million in February. According to April Education. changes were made to  promote greater integration. control and synergies between its various business units. simplifying its management processes. polite Abril announced last Thursday the extinction of Alfa magazines. Bravo !. Gloss and Lola. beyond the Club Alfa portal. According to the company. 150 professionals from various fields leave the company due to the reestruturação.A publisher said  four publications represented less than 2% of the advertising revenue of the magazines of April. The August issue of the magazine. circulating throughout the country starting next week. is the latest in each título.Além it. Abril announced changes in the editorial and commercial structures of April Segmented Business Units. See. Examination and Digital Business.  Among the main changes on the trade front. is the decentralization of the Director of Advertising Centralized. which will be distributed in each of the UN's (business units).  Abril sees this phase as part of the natural evolution of the business and continues with the mission to spread the information. with editorial excellence. pioneering and integrity. he said. in a statement. President of Abril SA. Fábio Colletti Barbosa. 	1	1	-1	0	0	1	0	1	0	-1	1	1	1	-1	1	-1	1	1	1
